"id","question_text","category","correct_answer","wrong_answers"
"670","What is the name of the common, gun-toting enemies of the ""Oddworld"" video game series?","video_games","Sligs","[""Scrabs"", ""Slogs"", ""Glukkons""]"
"671","One of the Nintendo Entertainment System voice channels supports playback of sound samples. Which one?","video_games","DMC","[""Noise"", ""Triangle"", ""Square""]"
"672","Which of the following is a class in the game ""Hearthstone""?","video_games","Priest","[""Sage"", ""Cleric"", ""Monk""]"
"673","The ""Day of Defeat"" series of games take place during which war?","video_games","World War II","[""World War I"", ""Vietnam War"", ""Iraq War""]"
"674","Which of the following has Jennifer Taylor NOT voiced?","video_games","Sarah Kerrigan","[""Princess Peach"", ""Zoey"", ""Cortana""]"
"675","In the game ""Terraria"", which of these bosses are pre-hardmode bosses?","video_games","Eye of Cthulhu","[""Plantera"", ""Skeletron Prime"", ""The Destroyer""]"
"676","In ""Yo! Noid 2,"" The Noid can perform what special move?","video_games","Dab","[""Pizza Throw"", ""Dodge Roll"", ""Spin Dash""]"
"677","In the Nintendo DS game 'Ghost Trick: Phantom Detective', what is the name of the hitman seen at the start of the game?","video_games","Nearsighted Jeego","[""One Step Ahead Tengo"", ""Missile"", ""Cabanela""]"
"678","In the game ""Persona 4"", what is the canonical name of the protagonist?","video_games","Yu Narukami","[""Chino Mashido"", ""Tunki Sunada"", ""Masaki Narinaka""]"
"679","How many stars are there to collect in Super Mario 64?","video_games","120","[""60"", ""80"", ""100""]"
"680","In the movie ""Back to the Future,"" what speed does Doc Brown's DeLorean need to reach in order to travel through time?","movies","88 mph","[""77 mph"", ""100 mph"", ""70 mph""]"
"681","In the movie Gremlins, after what time of day should you not feed Mogwai?","movies","Midnight","[""Evening"", ""Morning"", ""Afternoon""]"
"682","The 2016 Disney animated film 'Moana' is based on which culture?","movies","Polynesian","[""Native American"", ""Japanese"", ""Nordic""]"
"683","When does ""Rogue One: A Star Wars Story"" take place chronologically in the series?","movies","Between Episode 3 and 4","[""After Episode 6"", ""Before Episode 1"", ""Between Episode 4 and 5""]"
"684","Who did the score to the original Blade Runner?","movies","Vangelis","[""Kitaro"", ""Yanni"", ""Enya""]"
"685","Daniel Radcliffe became a global star in the film industry due to his performance in which film franchise?","movies","Harry Potter","[""Ted"", ""Spy Kids"", ""Pirates of the Caribbean ""]"
"686","Who voiced Metalbeard in ""The Lego Movie""?","movies","Nick Offerman","[""Liam Neeson"", ""Morgan Freeman"", ""Will Arnet""]"
"687","In the 1974 Christmas flick ""The Year Without a Santa Claus,"" what are the names of the two elves who help Mrs. Claus save Christmas?","movies","Jingle & Jangle","[""Buddy & Bobby"", ""Holly & Jolly"", ""Snowflake & Icicle""]"
"688","In the Friday The 13th series, what year did Jason drown in?","movies","1957","[""1955"", ""1953"", ""1959""]"
"689","In the movie ""Spaceballs"", what are the Spaceballs attempting to steal from Planet Druidia?","movies","Air","[""The Schwartz"", ""Princess Lonestar"", ""Meatballs""]"
"690","Which year was the first official Youtube Rewind released?","movies","2010","[""2012"", ""2011"", ""2013""]"
"691","In the 2012 film, ""The Lorax"", who is the antagonist?","movies","Aloysius O'Hare","[""Ted Wiggins"", ""The Once-Ler"", ""Grammy Norma""]"
"692","What is the name of James Dean's character in the 1955 movie ""Rebel Without a Cause""?","movies","Jim Stark","[""Ned Stark"", ""Jim Kane"", ""Frank Stark""]"
"693","Who voices the main character Blu in the 2011 animated film ""Rio""?","movies","Jesse Eisenberg","[""Michael Cera"", ""Jonah Hill"", ""Zach Galifianakis""]"
"694","What film did James Cameron's Avatar dethrone as the highest-grossing film ever?","movies","Titanic","[""Star Wars"", ""Gone with the Wind"", ""Jaws""]"
"695","Which 1994 film did Roger Ebert famously despise, saying ""I hated hated hated hated hated this movie"".","movies","North","[""3 Ninjas Kick Back"", ""The Santa Clause"", ""Richie Rich""]"
"696","In the Friday The 13th series, what is Jason's mother's first name?","movies","Pamela","[""Mary"", ""Christine"", ""Angeline""]"
"697","In the ""Jurassic Park"" universe, when did ""Jurassic Park: San Diego"" begin construction?","movies","1985","[""1988"", ""1986"", ""1993""]"
"698","Which of the following actors has only been in a Quentin Tarantino directed film once?","movies","John Travolta","[""Christoph Waltz"", ""Harvey Keitel"", ""Samuel L. Jackson""]"
"699","In which 1955 film does Frank Sinatra play Nathan Detroit?","movies","Guys and Dolls","[""Anchors Aweigh"", ""From Here to Eternity"", ""High Society""]"
"700","What is the name of the dog that played Toto in the 1939 film ""The Wizard of Oz""?","movies","Terry","[""Tommy"", ""Teddy"", ""Toto""]"
"701","In the movie “The Iron Giant,” this character is the protagonist.","movies","Hogarth Hughes","[""Kent Mansley"", ""Dean McCoppin"", ""Annie Hughes""]"
"702","Which actor auditioned for the role of Luke Skywalker?","movies","Kurt Russell","[""Christopher Lambert"", ""Laurence Fishburne"", ""James Remar""]"
"703","Which retired American football quarterback played himself in 'Ace Ventura: Pet Detective' and 'Little Nicky'?","movies","Dan Marino","[""John Elway"", ""Tom Brady"", ""Joe Montana""]"
"704","Which of these Disney classics was released in 1970?","movies","The Aristocats","[""One Hundred and One Dalmatians"", ""The Fox and the Hound"", ""The Little Mermaid""]"
"705","What was the name of the protagonist in the movie Commando (1985)?","movies","John Matrix","[""Ben Richards"", ""Douglas Quaid"", ""Harry Tasker""]"
"706","In Back to the Future Part II, Marty and Dr. Emmett Brown go to which future date?","movies","October 21, 2015","[""August 28, 2015"", ""July 20, 2015"", ""January 25, 2015""]"
"707","What was Marilyn Monroe`s character's first name in the film ""Some Like It Hot""?","movies","Sugar","[""Honey"", ""Caramel"", ""Candy""]"
"708","Which of the following James Bond villains is not affiliated with the SPECTRE organization?","movies","Auric Goldfinger","[""Dr. Julius No"", ""Rosa Klebb"", ""Emilio Largo""]"
"709","Mark Wahlberg played the titular character of which 2008 video-game adaptation?","movies","Max Payne","[""Alan Wake"", ""Hitman"", ""God Of War""]"
"710","Who directed the movie ""Alien""?","movies","Ridley Scott","[""Christopher Nolan"", ""Michael Bay"", ""James Cameron""]"
"711","In the 1999 movie Fight Club, which of these is not a rule of the ""fight club""?","movies","Always wear a shirt","[""You do not talk about FIGHT CLUB"", ""Only two guys to a fight"", ""Fights will go on as long as they have to""]"
"712","This trope refers to minor characters that are killed off to show how a monster works.","movies","Red Shirt","[""Minions"", ""Expendables"", ""Cannon Fodder""]"
"713","Which animated movie was first to feature a celebrity as a voice actor?","movies","Aladdin","[""Toy Story"", ""James and the Giant Peach"", ""The Hunchback of Notre Dame""]"
"714","In what year did Clint Eastwood star as Inspector Harry Callahan in the film ""Dirty Harry""?","movies","1971","[""1975"", ""1983"", ""1969""]"
"715","In The Lord of the Rings: The Fellowship of the Ring, which one of the following characters from the book was left out of the film?","movies","Tom Bombadil","[""Strider"", ""Barliman Butterbur"", ""Celeborn""]"
"716","In the movie ""V for Vendetta,"" what is the date that masked vigilante ""V"" urges people to remember?","movies","November 5th","[""November 6th"", ""November 4th"", ""September 5th""]"
"717","Which of these movies did Jeff Bridges not star in?","movies","The Hateful Eight","[""Tron: Legacy"", ""The Giver"", ""True Grit""]"
"718","In which African country was the 2006 film 'Blood Diamond' mostly set in?","movies","Sierra Leone","[""Liberia"", ""Burkina Faso"", ""Central African Republic""]"
"719","In which movie does Robin Williams' character have to disguise themselves into a woman?","movies","Mrs. Doubtfire","[""Old Dogs"", ""Jumanji"", ""Awakenings""]"
"720","What Queen song plays during the final fight scene of the film ""Hardcore Henry""?","movies","Don't Stop Me Now","[""Brighton Rock"", ""Another Bites the Dust"", ""We Will Rock You""]"
"721","In the 1992 film ""Army of Darkness"", what name does Ash give to his double-barreled shotgun?","movies","Boomstick","[""Bloomstick"", ""Blastbranch"", ""2-Pump Chump""]"
"722","Who was the director of ""Scott Pilgrim vs. the World (2010)""?","movies","Edgar Wright","[""Phil Lord"", ""Chris Miller"", ""Seth Rogan""]"
"723","The 1996 film 'Fargo' is primarily set in which US state?","movies","Minnesota","[""North Dakota"", ""South Dakota"", ""Wisconsin""]"
"724","About how much money did it cost for Tommy Wiseau to make his masterpiece ""The Room"" (2003)?","movies","$6 Million","[""$20,000"", ""$1 Million"", ""$10 Million""]"
"725","Who voiced the character Draco in the 1996 movie 'DragonHeart'?","movies","Sean Connery","[""Dennis Quaid"", ""Pete Postlethwaite"", ""Brian Thompson""]"
"726","In the film ""Interstellar"", how long did they spend on Miller's planet?","movies","23 years, 4 months, and 8 days","[""15 years, 2 months, and 15 days"", ""10 months and 6 days"", ""26 years, 4 months, and 10 days""]"
"727","What is the name of the Artificial Intelligence system in the 1983 film, ""WarGames""?","movies","War Operation Plan Response","[""Self Evolving Thought Helix"", ""Master Control Program"", ""West Campus Analog Computer""]"
"728","What is the name of the queen's pet in A Bug's Life?","movies","Aphie","[""Flik"", ""Hopper"", ""Dot""]"
"729","Which animated film did Steven Lisberger direct in 1980 before going on to direct Tron?","movies","Animalympics","[""The Fox and the Hound"", ""The Black Cauldron"", ""The Great Mouse Detecive""]"
"730","In Mulan (1998), who is the leader of the Huns?","movies","Shan Yu","[""Chien-Po"", ""Li Shang"", ""Fa Zhou""]"
"731","Who is the director of the 1991 film ""Silence of the Lambs""?","movies","Jonathan Demme","[""Stanley Kubrick"", ""Frank Darabont"", ""Michael Bay""]"
"732","Who played the Cenobite called ""Pinhead"" in the original Hellraiser films?","movies","Doug Bradley","[""Doug Jones"", ""Doug Savant"", ""Doug Benson""]"
"733","Who played Sgt. Gordon Elias in 'Platoon' (1986)?","movies","Willem Dafoe","[""Charlie Sheen"", ""Matt Damon"", ""Johnny Depp""]"
"734","What is the species of the ""Predator"" in the 1987 movie ""Predator""?","movies","Yautja","[""Xenomorph"", ""Praetorian"", ""Phocrex""]"
"735","What is the name of the foley artist who designed the famous sounds of Star Wars, including Chewbacca's roar and R2-D2's beeps and whistles?","movies","Ben Burtt","[""Ken Burns"", ""Ralph McQuarrie"", ""Miranda Keyes""]"
"736","Which former Star Trek actor directed Three Men and a Baby (1987)?","movies","Leonard Nimoy","[""William Shatner"", ""George Takei"", ""James Doohan""]"
"737","What was the last Marx Brothers film to feature Zeppo?","movies","Duck Soup","[""A Night at the Opera"", ""A Day at the Races"", ""Monkey Business""]"
"738","In the Mad Max franchise, what type of car is the Pursuit Special driven by Max?","movies","Ford Falcon","[""Holden Monaro"", ""Chrysler Valiant Charger"", ""Pontiac Firebird""]"
"739","How much money did the 2019 Marvel movie ""Avengers: Endgame"" gross for it's record-breaking worldwide opening weekend?","movies","1.2 billion USD","[""640 million USD"", ""456 million USD"", ""392 million USD""]"
"740","Velma Kelly and Roxie Hart are the protagonists of which Oscar winning movie?","movies","Chicago","[""Dreamgirls"", ""Cabaret"", ""All That Jazz""]"
"741","Which Marvel superhero did Chris Evans play prior to his role as Captain America?","movies","Human Torch","[""Cyclops"", ""Iceman"", ""Daredevil""]"
"742","What type of cheese, loved by Wallace and Gromit, had it's sale prices rise after their successful short films?","movies","Wensleydale","[""Cheddar"", ""Moon Cheese"", ""Edam""]"
"743","Which movie sequel had improved box office results compared to its original film?","movies","Toy Story 2","[""Sin City: A Dame to Kill For"", ""Speed 2: Cruise Control"", ""Son of the Mask""]"
"744","What was the first movie to ever use a Wilhelm Scream?","movies","Distant Drums","[""Treasure of the Sierra Madre"", ""The Charge at Feather River"", ""Indiana Jones""]"
"745","What was the first James Bond film?","movies","Dr. No","[""Goldfinger"", ""From Russia With Love"", ""Thunderball""]"
"746","Which stand-up comedian voiced the talking parrot ""Iago"" in Disney's 1992 adaptation of Aladdin?","movies","Gilbert Gottfried","[""Robin Williams"", ""Pauly Shore"", ""Jonathan Freeman""]"
"747","In the 1979 British film ""Quadrophenia"" what is the name of the main protagonist?","movies","Jimmy Cooper","[""Pete Townshend"", ""Franc Roddam"", ""Archie Bunker""]"
"748","The killer in the 1981 film 'My Bloody Valentine' wears what sort of outfit?","movies","Mining gear","[""Clown costume"", ""Santa suit"", ""Police uniform""]"
"749","Which of the following movies was not based on a book?","movies","Citizen Kane","[""The Godfather"", ""Forrest Gump"", ""Jurassic Park""]"
"750","For the film ""Raiders of The Lost Ark"", what was Harrison Ford sick with during the filming of the Cairo chase?","movies","Dysentery","[""Anemia"", ""Constipation"", ""Acid Reflux ""]"
"751","Who directed ""E.T. the Extra-Terrestrial"" (1982)?","movies","Steven Spielberg","[""Stanley Kubrick"", ""James Cameron"", ""Tim Burton""]"
"752","Which of these Movies was NOT released in 1996?","movies","Gladiator","[""Independence Day"", ""The Rock"", ""Mission: Impossible""]"
"753","In the Lord of the Rings: The Two Towers, where are the party of orcs taking the hobbits?","movies","Isengard","[""Rivendell"", ""Mordor"", ""Moria""]"
"754","In the ""Jurassic Park"" universe, what is the name of the island that contains InGen's Site B?","movies","Isla Sorna","[""Isla Nublar"", ""Isla Pena"", ""Isla Muerta""]"
"755","In Big Hero 6, what fictional city is the Big Hero 6 from?","movies","San Fransokyo","[""San Tokyo"", ""Tokysisco"", ""Sankyo""]"
"756","Which sci-fi cult films plot concerns aliens attempting to prevent humans from creating a doomsday weapon?","movies","Plan 9 from Outer Space","[""The Man from Planet X"", ""It Came from Outer Space"", ""The Day The Earth Stood Still""]"
"757","Which movie contains the quote, ""Say hello to my little friend!""?","movies","Scarface","[""Reservoir Dogs"", ""Heat"", ""Goodfellas""]"
"758","Darth Vader's famous reveal to Luke is iconic. But which of these is the right one?","movies","""No. I am your father.""","[""\""Luke, I am your father.\"""", ""\""You're wrong. I am your father.\"""", ""\""The truth is that I am your father.\""""]"
"759","Who directed the 1973 film ""American Graffiti""?","movies","George Lucas","[""Ron Howard"", ""Francis Ford Coppola"", ""Steven Spielberg""]"
"760","Who played Deputy Marshal Samuel Gerard in the 1993 film ""The Fugitive""?","movies","Tommy Lee Jones","[""Harrison Ford"", ""Harvey Keitel"", ""Martin Landau""]"
"761","Brendan Fraser starred in the following movies, except which one?","movies","Titanic","[""Monkeybone"", ""Encino Man"", ""Mrs. Winterbourne""]"
"762","What three movies, in order from release date, make up the ""Dollars Trilogy""?","movies","""A Fistful of Dollars"", ""For a Few Dollars More"", ""The Good, the Bad, and the Ugly""","[""\""The Good, the Bad, and the Ugly\"", \""For A Few Dollars More\"", \""A Fistful of Dollars\"""", ""\""For a Few Dollars More\"", \""The Good, the Bad, and the Ugly\"", \""A Fistful of Dollars\"""", ""\""For a Few Dollars More\"", \""A Fistful of Dollars\"", \""The Good, the Bad, and the Ugly\""""]"
"763","What character in the Winnie the Pooh films was added by Disney and does not appear in the original books?","movies","Gopher","[""Tigger"", ""Heffalumps"", ""Rabbit""]"
"764","What is the make and model of the tour vehicles in ""Jurassic Park"" (1993)?","movies","1992 Ford Explorer XLT","[""1992 Toyota Land Cruiser"", ""1992 Jeep Wrangler YJ Sahar"", ""Mercedes M-Class""]"
"765","Which one of these films are shot entirely in one-take?","movies","Russian Ark","[""Good Will Hunting"", ""Birdman"", ""Schindler's List""]"
"766","Who directed the 2015 movie ""The Revenant""?","movies","Alejandro G. Iñárritu","[""Christopher Nolan"", ""David Fincher"", ""Wes Anderson""]"
"767","Which was the first of Alfred Hitchcock's movies to be filmed in colour?","movies","Rope","[""Psycho"", ""Vertigo"", ""Rebecca""]"
"768","In Big Hero 6, what were Baymax's motions modeled after?","movies","Baby penguins","[""Baby monkeys"", ""Baby ostriches"", ""Baby bears""]"
"769","In the film ""Harry Potter and the Order of The Phoenix"", why was Harry Potter's scream, after Sirius Black died, muted?","movies","Too Agonizing","[""Too Loud"", ""Too Harsh"", ""Too Violent""]"
"770","Who in Pulp Fiction says ""No, they got the metric system there, they wouldn't know what the f*** a Quarter Pounder is.""","movies","Vincent Vega","[""Jules Winnfield"", ""Jimmie Dimmick"", ""Butch Coolidge""]"
"771","What is the name of the first ""Star Wars"" film by release order?","movies","A New Hope","[""The Phantom Menace"", ""The Force Awakens"", ""Revenge of the Sith""]"
"772","In the 1994 movie ""Speed"", what is the minimum speed the bus must go to prevent to bomb from exploding?","movies","50 mph","[""60 mph"", ""40 mph"", ""70 mph""]"
"773","In ""Star Trek Nemesis"", why was Praetor Shinzon created?","movies","To replace Picard as a Romulan Agent","[""To destroy the Enterprise"", ""To become Picard's friend "", ""To steal the Enterprise""]"
"774","Which of the following is not the name of a ""Bond Girl""? ","movies","Vanessa Kensington","[""Pam Bouvier"", ""Mary Goodnight"", ""Wai Lin""]"
"775","What is the name of the fictional retro-mod band starring Austin Powers as the lead vocalist?","movies","Ming Tea","[""Cough Fi"", ""Spear Mint"", ""Mister E""]"
"776","In the movie ""Cast Away"" the main protagonist's best friend while on the island is named","movies","Wilson","[""Carson"", ""Jackson"", ""Willy""]"
"777","This movie contains the quote, ""Nobody puts Baby in a corner.""","movies","Dirty Dancing","[""Three Men and a Baby"", ""Ferris Bueller's Day Off"", ""Pretty in Pink""]"
"778","Which of the following is NOT a quote from the 1942 film Casablanca? ","movies","""Frankly, my dear, I don't give a damn.""","[""\""Here's lookin' at you, kid.\"""", ""“Of all the gin joints, in all the towns, in all the world, she walks into mine…”"", ""\""Round up the usual suspects.\""""]"
"779","In the movie ""Scream"" who is Ghost Face?","movies","Billy Loomis and Stu Macher","[""Dewey Riley"", ""Sidney Prescott"", ""Archie Prescott and Philip Marv""]"
"780","In which film does Humphrey Bogart say the famous line, ""Here's looking at you, kid""?","movies","Casablanca","[""The Maltese Falcon"", ""The Treasure of the Sierra Madre"", ""Citizen Kane""]"
"781","What is Lilo's last name from Lilo and Stitch?","movies","Pelekai","[""Anoaʻi"", ""Kealoha"", ""Kuʻulei""]"
"782","The film Mad Max: Fury Road features the Dies Irae  from which composer's requiem?","movies","Verdi","[""Mozart"", ""Berlioz"", ""Brahms""]"
"783","Who wrote and directed the 1986 film 'Platoon'?","movies","Oliver Stone","[""Francis Ford Coppola"", ""Stanley Kubrick"", ""Michael Cimino""]"
"784","What did Alfred Hitchcock use as blood in the film ""Psycho""? ","movies","Chocolate syrup","[""Ketchup"", ""Red food coloring"", ""Maple syrup""]"
"785","Which boxer was famous for striking the gong in the introduction to J. Arthur Rank films?","movies","Bombardier Billy Wells","[""Freddie Mills"", ""Terry Spinks"", ""Don Cockell""]"
"786","This movie contains the quote, ""I love the smell of napalm in the morning!""","movies","Apocalypse Now","[""Platoon"", ""The Deer Hunter"", ""Full Metal Jacket""]"
"787","Johnny Depp made his big-screen acting debut in which film?","movies","A Nightmare on Elm Street","[""My Bloody Valentine"", ""Halloween"", ""Friday the 13th""]"
"788","In what year was the movie ""Police Academy"" released?","movies","1984","[""1986"", ""1985"", ""1983""]"
"789","Which 90's comedy cult classic features cameos appearances from Meat Loaf, Alice Cooper and Chris Farley?","movies","Wayne's World","[""Bill & Ted's Excellent Adventure"", ""Dumb and Dumber"", ""Austin Powers: International Man of Mystery""]"
"790","What did the first moving picture depict?","movies","A galloping horse","[""A woman in a dress"", ""A man walking"", ""A crackling fire""]"
"791","Which documentary film maker wrote and starred in the film ""My Scientology Movie"" which first debuted in 2015?","movies","Louis Theroux","[""Errol Morris"", ""Joe Berlinger"", ""Adam Curtis""]"
"792","In the 1964 film ""Zulu"", what song does the British Army company sing before the final battle?","movies","Men of Harlech","[""Scotland the Brave"", ""Colonel Bogey March"", ""The British Grenadiers""]"
"793","What is the name of the supercomputer located in the control room in ""Jurassic Park"" (1993)?","movies","Thinking Machines CM-5","[""Cray X-MP"", ""Cray XK7"", ""IBM Blue Gene/Q""]"
"794","Who plays protagonist Ethan Hunt in the ""Mission: Impossible"" film-series?","movies","Tom Cruise","[""Johnny Depp"", ""Sean Connery"", ""Pierce Brosnan""]"
"795","In what Disney movie can you spot the character ""Pac-Man"" in if you look closely enough in some scenes?","movies","Tron","[""Big Hero 6"", ""Fantasia"", ""Monsters, Inc.""]"
"796","What was the name of the planet in ""Aliens""?","movies","LV-426","[""Weyland Yutani Corporation Base"", ""FR-838"", ""DI-621""]"
"797","What was the name of the actor who played Leatherface in the 1974 horror film, The Texas Chainsaw Massacre?","movies","Gunnar Hansen","[""Edwin Neal"", ""John Dugan"", ""Joe Bill Hogan""]"
"798","Which actors made up the trio in ""The Good, the Bad, and the Ugly""? ","movies","Clint Eastwood, Eli Wallach, and Lee Van Cleef","[""Sergio Leone, Ennio Morricone, and Tonino Delli Colli"", ""Yul Brynner, Steve McQueen, and Charles Bronson"", ""Aldo Giuffrè, Mario Brega, and Luigi Pistilli""]"
"799","Who starred as Bruce Wayne and Batman in Tim Burton's 1989 movie ""Batman""?","movies","Michael Keaton","[""George Clooney"", ""Val Kilmer"", ""Adam West""]"
"800","Before ""Jurassic Park III"" was finalized and the Spinosaurus was chosen, which dinosaur was going to be the star?","movies","Baryonyx","[""Tyrannosaurus Rex"", ""Velociraptor"", ""Suchomimus""]"
"801","What year did the movie ""Napoleon Dynamite"" come out?","movies","2004","[""2002"", ""2003"", ""2005""]"
"802","In ""ALF"", what was ALF's real name?","movies","Gordon Shumway","[""Gordon Milipp"", ""Gordon Foster"", ""Gordon von Gam""]"
"803","Which actress portrayed Dr. Grace Augustine in the James Cameron movie ""Avatar""?","movies","Sigourney Weaver","[""Jessica Chastain"", ""Melissa Beckett"", ""Alyssa Monroe ""]"
"804","Who performed the opening theme song for the James Bond 007 movie ""Goldfinger""?","movies","Shirley Basey","[""Tom Jones"", ""John Barry"", ""Sheena Easton""]"
"805","What is the name of the island that ""Jurassic Park"" is built on?","movies","Isla Nublar","[""Isla Sorna"", ""Isla Muerta"", ""Isla Pena""]"
"806","""The first rule is: you don't talk about it"" is a reference to which movie?","movies","Fight Club","[""The Island"", ""Unthinkable"", ""American Pie""]"
"807","In Finding Nemo, what was the name of Nemo's mom?","movies","Coral","[""Sandy"", ""Pearl"", ""Shelly""]"
"808","The 2002 film ""28 Days Later"" is mainly set in which European country?","movies","United Kingdom","[""France"", ""Italy"", ""Germany""]"
"809","In the ""Jurassic Park"" universe, what was the first dinosaur cloned by InGen in 1986?","movies","Velociraptor","[""Triceratops"", ""Troodon"", ""Brachiosaurus""]"
"810","According to ""Star Wars"" lore, which planet does Obi-Wan Kenobi come from?","movies","Stewjon","[""Alderaan"", ""Tatooine"", ""Naboo""]"
"811","In the 2014 film ""Birdman"", what is the primary instrument in the score?","movies","Drums","[""Saxophone"", ""Violin"", ""Actual Live Birds Singing""]"
"812","How old was Laurence Fishburne when Francis Ford Coppola cast him in Apocalypse Now (1979)? ","movies","14","[""16"", ""18"", ""20""]"
"813","In the film ""Requiem for a Dream"", what drug does Jared Leto's character get addicted to?","movies","Heroin","[""Cocaine"", ""Marijuana"", ""Oxycodone""]"
"814","Which of these actors/actresses is NOT a part of the cast for the 2016 movie ""Suicide Squad""?","movies","Scarlett Johansson","[""Jared Leto"", ""Will Smith"", ""Margot Robbie""]"
"815","What is the name of the villian in the 2015 Russian-American Sci-Fi Movie ""Hardcore Henry""?","movies","Akan","[""Estelle"", ""Jimmy"", ""Henry""]"
"816","Who plays the character of Po in the Kung Fu Panda movies?","movies","Jack Black","[""Mirana Jonnes"", ""McConahey Ramses"", ""Jim Petersson""]"
"817","According to the Star Wars lore, what is Han Solo's home planet?","movies","Corellia","[""Tatooine"", ""Naboo"", ""Coruscant""]"
"818","In the 1976 film 'Taxi Driver', how many guns did Travis buy from the salesman?","movies","4","[""2"", ""6"", ""1""]"
"819","What year did the James Cameron film ""Titanic"" come out in theaters?","movies","1997","[""1996"", ""1998"", ""1999""]"
"820","Which of the following movies was not based on a novel by Stephen King? ","movies","The Thing","[""Carrie"", ""Misery"", ""The Green Mile""]"
"821","Who plays ""Bruce Wayne"" in the 2008 movie ""The Dark Knight""?","movies","Christian Bale","[""Michael Caine"", ""Ron Dean"", ""Heath Ledger""]"
