"id","question_text","category","correct_answer","wrong_answers"
"990","What year was ""JoJo's Bizarre Adventure: Phantom Blood"" first released?","anime","1987","[""2013"", ""1983"", ""1995""]"
"991","The main antagonist of the second part of JoJo's Bizarre Adventure is which of the following?","anime","Kars","[""Erina Joestar"", ""Santana"", ""Wired Beck""]"
"992","Who voices ""Shou Suzuki"" in the English dub of ""Mob Psycho 100""?","anime","Casey Mongillo","[""Ben Diskin"", ""Chris Niosi"", ""David Naughton""]"
"993","In the anime, ""Super Sonico"", what is Super Sonico's favorite food?","anime","Macroons","[""Ice Cream"", ""Pizza"", ""Chips""]"
"994","In the 2012 animated film ""Wolf Children"", what are the names of the wolf children?","anime","Ame & Yuki","[""Hana & Yuki"", ""Ame & Hana"", ""Chuck & Anna""]"
"995","Who was the first Legendary Pokemon to be defeated by Ash Ketchum in the Pokémon anime?","anime","Articuno","[""Darkrai"", ""Latios"", ""Regice""]"
"996","Who voices the character ""Reigen""  in the English dub of ""Mob Psycho 100""?","anime","Chris Niosi","[""Max Mittelman"", ""Kyle McCarley"", ""Casey Mongillo""]"
"997","Who is the creator of the manga series ""One Piece""?","anime","Eiichiro Oda","[""Yoshihiro Togashi"", ""Hayao Miyazaki"", ""Masashi Kishimoto""]"
"998","What is the name of the stuffed lion in Bleach?","anime","Kon","[""Jo"", ""Urdiu"", ""Chad""]"
"999","The characters of ""Log Horizon"" are trapped in what game?","anime","Elder Tale","[""Sword Art Online"", ""Tower Unite"", ""Yggdrasil""]"
"1000","What year did the anime ""Himouto! Umaru-chan"" air?","anime","2015","[""2014"", ""2012"", ""2013""]"
"1001","Which song was the callsign for Stefan Verdemann's KWFM radio station in Urasawa Naoki's ""Monster""?","anime","Over the Rainbow","[""What a Wonderful World"", ""When You Wish Upon A Star"", ""Singing In The Rain""]"
"1002","Which of the following originated as a manga?","anime","Akira","[""Cowboy Bebop"", ""High School DxD"", ""Gurren Lagann""]"
"1003","What was studio Trigger's first original long-form animated series for television?","anime","Kill la Kill","[""Kiznaiver"", ""Inferno Cop"", ""Gurren Lagann""]"
"1004","What is the last line muttered in the anime film ""The End of Evangelion""?","anime","""How disgusting.""","[""\""Idiot, I won't let you kill me!\"""", ""\""Nothing.\"""", ""\""Goddammit, Shinji.\""""]"
"1005","Which studio animated Soul Eater?","anime","Bones","[""Kyoto Animation"", ""xebec"", ""Production I.G""]"
"1006","In ""Hunter x Hunter"", what are members in Killua's family known for being?","anime","Assassins","[""Bandits"", ""Hunters"", ""Ninjas""]"
"1007","In ""Inuyasha"", what are the heros are looking to collect?","anime","Jewel Shards","[""Dragon Balls"", ""Rave Stones"", ""Sacred Stones""]"
"1008","Which one of these characters is from ""Legendz : Tale of the Dragon Kings""?","anime","Shiron","[""Jack"", ""Axia"", ""Drum""]"
"1009","What is the name of the school in the anime and manga ""Gosick""?","anime","St. Marguerite","[""St. Augustine"", ""St. Mary"", ""St. Bernadette""]"
"1010","Which anime did Seiji Kishi NOT direct?","anime","Another","[""Humanity Has Declined"", ""Assassination Classroom"", ""Danganronpa: The Animation""]"
"1011","In ""Love Live: School Idol Project"" what pseudonym does Kotori Minami use in her job as a maid?","anime","Minalinsky","[""Stanoytchev"", ""Kuznetsov"", ""Aqours""]"
"1012","Aoi Miyamori is the production manager of what anime in ""Shirobako""?","anime","The Third Aerial Girls Squad","[""Exodus!"", ""Andes Chucky"", ""Angel Beats!""]"
"1013","In ""Highschool DxD"", Koneko Toujou is from what race?","anime","Nekomata","[""Kitsune"", ""Human"", ""Kappa""]"
"1014","In ""Highschool DxD"", what is the name of the item some humans are born with?","anime","Sacred Gear","[""Imperial Arm"", ""Hallowed Relic"", ""Blessed Artifact""]"
"1015","Which band name isn't a Stand in ""JoJo's Bizarre Adventure""?","anime","AC/DC","[""Green Day"", ""Survivor"", ""Red Hot Chili Peppers""]"
"1016","In ""JoJo's Bizarre Adventure: Stardust Crusaders"", what is the last name of the protagonist Jotaro?","anime","Kujo","[""Cujoh"", ""Joestar"", ""Higashikata""]"
"1017","In the series JoJo's Bizarre Adventure, which main character makes the greatest number of recurring appearances?","anime","Jotaro Kujo","[""Giorno Giovanna"", ""Joseph Joestar"", ""Josuke Higashikata""]"
"1018","In the Overlord Anime who was Cocytus made by?","anime","Warrior Takemikazuchi","[""Peroroncino"", ""Ulbert Alain Odle"", ""Bukubukuchagama""]"
"1019","In ""JoJo's Bizarre Adventure"", which of the following Stands does NOT have a time-based ability?","anime","20th Century Boy","[""Made in Heaven"", ""Star Platinum"", ""The World""]"
"1020","Which Pokémon and it's evolutions were banned from appearing in a main role after the Episode 38 Incident?","anime","The Porygon Line","[""The Pikachu Line"", ""The Elekid Line"", ""The Magby Line""]"
"1021","Which anime heavily features music from the genre ""Eurobeat""?","anime","Initial D","[""Wangan Midnight"", ""Kino no Tabi"", ""Cowboy Bebop""]"
"1022","In JoJo's Bizarre Adventure, who says ""Yare yare daze""?","anime","Jotaro Kujo","[""Joseph Joestar"", ""Jolyne Cujoh"", ""Koichi Hirose""]"
"1023","In ""Black Lagoon"", what colour is Rock's tie?","anime","Teal","[""Crimson"", ""Dark Brown"", ""Black""]"
"1024","Which part from the JoJo's Bizarre Adventure manga is about a horse race across America?","anime","Part 7: Steel Ball Run","[""Part 6: Stone Ocean"", ""Part 3: Stardust Crusaders"", ""Part 5: Golden Wind""]"
"1025","What name is the main character Chihiro given in the 2001 movie ""Spirited Away""?","anime","Sen (Thousand)","[""Hyaku (Hundred)"", ""Ichiman (Ten thousand)"", ""Juu (Ten)""]"
"1026","Which studio made Cowboy Bebop?","anime","Sunrise","[""Bones"", ""Madhouse"", ""Pierriot""]"
"1027","In ""A Certain Scientific Railgun"", how many ""sisters"" did Accelerator have to kill to achieve the rumored level 6?","anime","20,000","[""128"", ""10,000"", ""5,000""]"
"1028","The heroine of ""Humanity Has Declined"" is a mediator between humans and what?","anime","Fairies","[""Elves"", ""The Earth"", ""Animals""]"
"1029","In the first episode of Yu-Gi-Oh: Duel Monsters, what book is Seto Kaiba seen reading at Domino High School?","anime","Thus Spoke Zarathustra","[""Beyond Good and Evil"", ""The Republic"", ""Meditations""]"
"1030","In Dragon Ball Z, who was the first character to go Super Saiyan 2?","anime","Gohan","[""Goku"", ""Vegeta"", ""Trunks""]"
"1031","In ""To Love-Ru"", Ren and Run are from what planet?","anime","Memorze","[""Deviluke"", ""Mistletoe"", ""Okiwana""]"
"1032","Who is the main character in One Piece?","anime","Luffy","[""Shanks"", ""Zoro"", ""Smoker""]"
"1033","Which animation studio produced the anime adaptation of ""xxxHolic""?","anime","Production I.G","[""Sunrise"", ""Xebec"", ""Kyoto Animation""]"
"1034","Who is the main character with yellow hair in the anime Naruto?","anime","Naruto","[""Ten Ten"", ""Sasuke"", ""Kakashi""]"
"1035","What was the reason for the banning of episode 35 of the ""Pokémon Original Series"" Anime?","anime","Gun Usage","[""Flashing Images"", ""Jynx"", ""Strong Violence""]"
"1036","In ""One Piece"", what does ""the Pirate King"" mean to the captain of the Straw Hat Pirates?","anime","Freedom","[""Promise"", ""Adventure"", ""Friendship""]"
"1037","Who is the colossal titan in ""Attack On Titan""?","anime","Bertolt Hoover","[""Reiner"", ""Eren"", ""Sasha""]"
"1038","Who is the true moon princess in Sailor Moon?","anime","Sailor Moon","[""Sailor Venus"", ""Sailor Mars"", ""Sailor Jupiter""]"
"1039","In what year did the manga ""Ping Pong"" begin serialization?","anime","1996","[""2014"", ""2010"", ""2003""]"
"1040","In the ""Sailor Moon"" series, what is Sailor Jupiter's civilian name?","anime","Makoto Kino","[""Minako Aino"", ""Usagi Tsukino"", ""Rei Hino""]"
"1041","In the anime Assassination Classroom what is the class that Korosensei teaches?","anime","Class 3-E","[""Class 3-A"", ""Class 3-B"", ""Class 3-D""]"
"1042","Krusty is the guild master of which guild in ""Log Horizon""?","anime","D. D. D","[""Silver Sword"", ""West Wind Brigade"", ""Oceanic Systems (Marine Agency)""]"
"1043","In which manga did the ""404 Girl"" from 4chan originate from?","anime","Yotsuba&!","[""Azumanga Daioh"", ""Lucky Star"", ""Clover""]"
"1044","In the 9th Pokemon movie, who is the Prince of the Sea?","anime","Manaphy","[""Ash"", ""May"", ""Phantom""]"
"1045","Which animation studio animated ""To Love-Ru""?","anime","Xebec","[""Trigger"", ""Sunrise"", ""Kyoto Animation""]"
"1046","In ""To Love-Ru: Darkness"", which of the girls attempt making a harem for Rito Yuuki?","anime","Momo Deviluke","[""Yami (Golden Darkness)"", ""Haruna Sairenji"", ""Mea Kurosaki""]"
"1047","Which studio animated Afro Samurai?","anime","Gonzo","[""Kyoto Animation"", ""xebec"", ""Production I.G""]"
"1048","In ""To Love-Ru"", who is the first to hear of Yami's past from her?","anime","Rito","[""Mikan"", ""Lala"", ""Haruna""]"
"1049","The character Momonga from the ""Overlord"" series orders his servants to call him by what name?","anime","Ainz Ooal Gown","[""Master"", ""Yggdrasil"", ""Kugane Maruyama""]"
"1050","In ""Jewelpet Sunshine"", what is the song that plays when Kanon and her friends bust out of prison?","anime","I Don't Want to Miss a Thing","[""Eye Of The Tiger"", ""Born to be Wild"", ""Ruby Ring""]"
"1051","What is the age of Ash Ketchum in Pokemon when he starts his journey?","anime","10","[""11"", ""12"", ""9""]"
"1052","What was Ash Ketchum's second Pokemon?","anime","Caterpie","[""Charmander"", ""Pikachu"", ""Pidgey""]"
"1053","In ""One Piece"", who is the girl who overcame her enslaved past and became an agent of an army to fight the corrupt government?","anime","Koala","[""Boa Hancock"", ""Nico Robin"", ""Emporio Ivankov ""]"
"1054","What is the name of the device that allows for infinite energy in the anime ""Dimension W""?","anime","Coils","[""Wires"", ""Collectors"", ""Tesla""]"
"1055","What colour hair does the main character of the Yu-Gi-Oh! original anime series have?","anime","Red, black and yellow","[""Red, yellow and green"", ""Red, black and green"", ""Red, purple and blue""]"
"1056","Who was given the title ""Full Metal"" in the anime series ""Full Metal Alchemist""?","anime","Edward Elric","[""Alphonse Elric"", ""Van Hohenheim"", ""Izumi Curtis""]"
"1057","In Haikyuu!!, who is not a member of Karasuno VBC?","anime","Shigeru Yahaba","[""Tadashi Yamaguchi"", ""Hisashi Kinoshita"", ""Kazuhito Narita""]"
"1058","What animation studio produced ""Gurren Lagann""?","anime","Gainax","[""Kyoto Animation"", ""Pierrot"", ""A-1 Pictures""]"
"1059","On what medium was ""Clannad"" first created?","anime","Visual novel","[""Anime"", ""Manga"", ""Light novel""]"
"1060","In ""Highschool of the Dead"", where did Komuro and Saeko establish to meet after the bus explosion?","anime","Eastern Police Station","[""The Center Mall"", ""Komuro's House"", ""On The Main Bridge""]"
"1061","In the anime series ""Full Metal Alchemist"", what do Alchemists consider the greatest taboo?","anime","Human Transmutation ","[""Transmuting Lead Into Gold"", ""Using Alchemy For Crime "", ""Preforming Without A Permit""]"
"1062","What color is Ryūko Matoi's half of the Scissor Blade in the anime Kill la KIll?","anime","Red","[""Green"", ""Blue"", ""Purple""]"
"1063","In the ""Re:Zero"" manga series, which of the following Sin Archbishops eats Rem's existence?","anime","Ley Batenkaitos","[""Roy Alphard"", ""Petelgeuse Romanee-Conti"", ""Louis Arneb""]"
"1064","In the anime Initial D, how does Takumi Fujiwara describe a drift?","anime","'. . . the front tires slide so the car won't face the inside'","[""'. . . the wheels lose traction, making the car slide sideways'"", ""'. . . the car oversteers through a curve, causing it to turn faster'"", ""'. . . you turn a lot'""]"
"1065","In the anime Seven Deadly Sins what is the name of one of the sins?","anime","Diane","[""Sakura"", ""Ayano"", ""Sheska""]"
"1066","The character Plum from ""No Game No Life"" is of what race?","anime","Dhampir","[""Flügel"", ""Imanity"", ""Seiren""]"
"1067","Who is the author of the manga series ""Astro Boy""?","anime","Osamu Tezuka","[""Mitsuteri Yokoyama"", ""Takao Saito"", ""Yoshihiro Tatsumi""]"
"1068","Who is the armored titan in ""Attack On Titan""?","anime","Reiner Braun","[""Armin Arlelt"", ""Mikasa Ackermann"", ""Eren Jaeger""]"
"1069","Which JoJo's Bizarre Adventure character possesses the Stand named Silver Chariot?","anime","Jean Pierre Polnareff","[""Noriaki Kakyoin"", ""Hol Horse"", ""Hermes Costello""]"
"1070","In 2013, virtual pop-star Hatsune Miku had a sponsorship with which pizza chain?","anime","Domino's","[""Papa John's"", ""Pizza Hut"", ""Sabarro's""]"
"1071","The name of Junko Enoshima's imposter at the beginning of Danganronpa: Trigger Happy Havoc is?","anime","Mukuro Ikusaba","[""Ryota Mitarai"", ""Ultimate Imposter"", ""Komaru Naegi""]"
"1072","Which animation studio produced ""Log Horizon""?","anime","Satelite","[""Sunrise"", ""Xebec"", ""Production I.G""]"
"1073","Who wrote and directed the animated movie ""Spirited Away"" (2001)?","anime","Hayao Miyazaki","[""Isao Takahata"", ""Mamoru Hosoda"", ""Hidetaka Miyazaki""]"
"1074","Which person from ""JoJo's Bizarre Adventure"" does NOT house a reference to a band, artist, or song earlier than 1980?","anime","Giorno Giovanna","[""Josuke Higashikata"", ""Jolyne Cujoh"", ""Johnny Joestar""]"
"1075","In ""Fairy Tail"", what is the nickname of Natsu Dragneel?","anime","The Salamander","[""The Dragon Slayer"", ""The Dragon"", ""The Demon""]"
"1076","What is the name of the corgi in Cowboy Bebop?","anime","Einstein","[""Edward"", ""Rocket"", ""Joel""]"
"1077","In the ""Toaru Majutsu no Index"" anime, Touma Kamijou is a level 0 esper that has the ability to do what?","anime","Dispell any esper or magical powers","[""Teleport"", ""Make telepathic communications"", ""Create electricity from his own body""]"
"1078","In the anime ""Mr. Osomatsu"", how many brothers does Osomatsu-san have?","anime","5","[""6"", ""7"", ""4""]"
"1079","Which of the following anime of the mecha genre began airing in 1982?","anime","The Super Dimension Fortress Macross","[""Mobile Suit Gundam"", ""Armored Trooper VOTOMS"", ""Neon Genesis Evangelion""]"
"1080","What is the last name of Edward and Alphonse in the Fullmetal Alchemist series.","anime","Elric","[""Ellis"", ""Eliek"", ""Elwood""]"
"1081","Which of the stands from ""JoJo's Bizarre Adventure"" mimics the likeness of a tomato?","anime","Pearl Jam","[""Red Hot Chili Pepper"", ""Cream Starter"", ""Nut King Call""]"
"1082","What song plays in the ending credits of the anime ""Ergo Proxy""?","anime","Paranoid Android","[""Sadistic Summer"", ""Bittersweet Symphony"", ""Mad World""]"
"1083","In ""Puella Magi Madoka Magica"", what is the first name of Madoka's younger brother?","anime","Tatsuya","[""Montoya"", ""Tomohisa"", ""Minato""]"
"1084","What is the name of the main character of the anime ""One-Punch Man""?","anime","Saitama","[""Genos"", ""Sonic"", ""King""]"
"1085","Which animation studio animated the 2016 anime ""Mob Psycho 100""?","anime","Bones","[""A-1 Pictures"", ""Shaft"", ""Madhouse""]"
"1086","In Digimon, what is the Japanese name for the final evolutionary stage?","anime","Ultimate","[""Mega"", ""Adult"", ""Champion""]"
"1087","What studio animated Ouran High School Host Club?","anime","Bones","[""Production I.G"", ""Kyoto Animation"", ""xebec""]"
"1088","In ""Shakugan no Shana"" what was the Shana usually referred as?","anime","Flame-Haired Burning-Eyed Hunter","[""Flame Haze"", ""Flame-Haired Burning-Eyed Haze"", ""Shana""]"
"1089","When was the first episode of Soul Eater released?","anime","2008","[""2003"", ""2005"", ""2011""]"
"1090","Which of the following countries does ""JoJo's Bizarre Adventure: Stardust Crusaders"" not take place in?","anime","Philippines","[""India"", ""Pakistan"", ""Egypt""]"
"1091","Which of these is not a world in the anime ""Buddyfight""?","anime","Ancient Dragon World","[""Dragon World"", ""Star Dragon World"", ""Darkness Dragon World""]"
"1092","In the 2011 TV anime series, ""THE iDOLM@STER"", what was the name of Iori's stuffed toy bunny?","anime","Charles","[""Bubsy"", ""Kero"", ""Usagi""]"
"1093","What is the theme song of ""Neon Genesis Evangelion""?","anime","A Cruel Angel's Thesis","[""Stardust Crusaders"", ""Requiem for a Dream"", ""God Knows""]"
"1094","What is the name of the protagonist of the 2017 anime ""Land of the Lustrous""?","anime","Phosphophyllite","[""Watermelon Tourmaline"", ""Cinnabar"", ""Padparadscha""]"
"1095","Who is the horror manga artist who made Uzumaki?","anime","Junji Ito","[""Kazuo Umezu"", ""Shintaro Kago"", ""Sui Ishida""]"
"1096","Satella in ""Re:Zero"" is the witch of what?","anime","Envy","[""Pride"", ""Sloth"", ""Wrath""]"
"1097","""Silhouette"", a song performed by the group 'KANA-BOON' is featured as the sixteenth opening of which anime?","anime","Naruto: Shippūden","[""One Piece"", ""Naruto"", ""Gurren Lagann""]"
"1098","Who is One Punch Man voiced by in the Japanese version.","anime","Makoto Furukawa","[""Zach Aguilar"", ""Kaito Ishikawa"", ""Max Mittelman ""]"
"1099","Which of these names are not a character of JoJo's Bizarre Adventure?","anime","JoJo Kikasu","[""Jean-Pierre Polnareff"", ""George Joestar"", ""Risotto Nero""]"
"1100","In the ""To Love-Ru"" series, how many Trans-weapons were created?","anime","3","[""1"", ""2"", ""4""]"
"1101","Which of the following films was NOT directed by Hayao Miyazaki?","anime","Wolf Children","[""Princess Mononoke"", ""Spirited Away"", ""Kiki's Delivery Service""]"
"1102","How does the character Dragowizard, Qinus Axia's from the anime ""Buddyfight"" differ between the Japanese and English dubs?","anime","Different Gender","[""Different Body Proportions"", ""Different Backstory"", ""Different Appearance""]"
"1103","In the ""Dragon Ball"" franchise, what is the name of Goku's brother?","anime","Raditz","[""Gohan"", ""Vegeta"", ""Bardock""]"
"1104","The two main characters of ""No Game No Life"", Sora and Shiro, together go by what name?","anime","Blank","[""Immanity"", ""Disboard"", ""Warbeasts""]"
"1105","Which of these anime have over 7,500 episodes?","anime","Sazae-san","[""Naruto"", ""One Piece"", ""Chibi Maruko-chan""]"
"1106","In ""Future Diary"", what is the name of Yuno Gasai's Phone Diary?","anime","Yukiteru Diary","[""Murder Diary"", ""Escape Diary "", ""Justice Diary ""]"
"1107","Which Japanese music group was formed to produce theme music for the anime ""Guilty Crown""?","anime","Egoist","[""Goose house"", ""Babymetal"", ""Garnidelia""]"
"1108","What mytological creatures have women's faces and vultures' bodies?","mythology","Harpies","[""Mermaids"", ""Nymph"", ""Lilith""]"
"1109","Who is the god of war in Polynesian mythology?","mythology","'Oro","[""Hina"", ""Kohara"", ""Māui""]"
"1110","This Greek goddess's name was chosen for the dwarf planet responsible for discord on Pluto's classification amongst astronomers.","mythology","Eris","[""Charon"", ""Ceres"", ""Dysnomia""]"
"1111","Hel was the daughter of which Norse Mythological figure?","mythology","Loki","[""Thor"", ""Odin"", ""Balder""]"
"1112","What immense structure is referred to in Norse Mythology as the Yggdrasil.","mythology","Tree","[""Mountain"", ""Temple"", ""Castle""]"
"1113","This Greek mythological figure is the god/goddess of battle strategy (among other things).","mythology","Athena","[""Ares"", ""Artemis"", ""Apollo""]"
"1114","According to the Egyptian Myth of Osiris, who murdered Osiris?","mythology","Set","[""Horus"", ""Ra"", ""Anhur""]"
"1115","What animal did Queen Pasipahe sleep with before she gave birth to the Minotaur in Greek Mythology?","mythology","Bull","[""Pig"", ""Ox"", ""Horse""]"
"1116","What is the name of the first human being in Norse mythology?","mythology","Ask","[""Asmund"", ""Ake"", ""Asger""]"
"1117","Who was the only god from Greece who did not get a name change in Rome?","mythology","Apollo","[""Demeter"", ""Zeus"", ""Athena""]"
"1118","Who was the Roman god of fire?","mythology","Vulcan","[""Apollo"", ""Jupiter"", ""Mercury""]"
"1119","Which greek god/goddess tossed a golden apple with the words ""for the fairest"" into the middle of the feast of the gods?","mythology","Eris","[""Hades"", ""Ares"", ""Artemis""]"
"1120","According to Japanese folklore, what is the favorite food of the Kappa.","mythology","Cucumbers","[""Kabocha"", ""Nasu"", ""Soba""]"
"1121","The Nike apparel and footwear brand takes it's name from the Greek goddess of what?","mythology","Victory","[""Courage"", ""Strength"", ""Honor""]"
"1122","Which Norse God has a horse named Sleipnir?","mythology","Odin","[""Thor"", ""Frigg"", ""Balder""]"
"1123","Who was the King of Gods in Ancient Greek mythology?","mythology","Zeus","[""Apollo"", ""Hermes"", ""Poseidon""]"
"1124","Who is a minor god that is protector and creator of various arts, such as cheese making and bee keeping.","mythology","Aristaeus","[""Autonoe"", ""Carme"", ""Cephisso""]"
"1125","Which of the following is not one of the Greek Fates?","mythology","Narcissus","[""Clotho"", ""Atropos"", ""Lachesis""]"
"1126","How many heads does Cerberus have?","mythology","3","[""2"", ""1"", ""5""]"
"1127","Which of the following is not true about the life of Tiresias?","mythology","Sailed with the Argonauts to find the golden fleece","[""Athena turned him into a woman, and then years later back into a man"", ""Hera blinded him after he agreed with Zeus in an argument"", ""Revealed to Oedipus that Oedipus had married his own mother""]"
"1128","Which of these Roman gods doesn't have a counterpart in Greek mythology?","mythology","Janus","[""Vulcan"", ""Juno"", ""Mars""]"
"1129","Neptune's greek name was...","mythology","Poseidon","[""Ares"", ""Zeus"", ""Apollo""]"
"1130","Who in Greek mythology, who led the Argonauts in search of the Golden Fleece?","mythology","Jason","[""Castor"", ""Daedalus"", ""Odysseus""]"
"1131","Who did Hippomenes defeat in a footrace?","mythology","Atalanta","[""Peleus"", ""Theseus"", ""Jason""]"
"1132","In Norse mythology, what is the name of the serpent which eats the roots of the ash tree Yggdrasil?","mythology","Nidhogg","[""Bragi"", ""Odin"", ""Ymir""]"
"1133","Which figure from Greek mythology traveled to the underworld to return his wife Eurydice to the land of the living?","mythology","Orpheus","[""Hercules"", ""Perseus"", ""Daedalus""]"
"1134","In Greek mythology, who is the god of wine?","mythology","Dionysus","[""Hephaestus"", ""Demeter"", ""Apollo""]"
"1135","Talos, the mythical giant bronze man, was the protector of which island?","mythology","Crete","[""Sardinia"", ""Sicily"", ""Cyprus""]"
"1136","In Greek mythology, Persephone must return to the underworld because she had eaten what kind of seeds?","mythology","Pomegranate","[""Sunflower"", ""Orange"", ""Fig""]"
"1137","What is the name of the Greek god of blacksmiths?","mythology","Hephaestus","[""Dyntos"", ""Vulcan"", ""Artagatus""]"
"1138","The greek god Poseidon was the god of what?","mythology","The Sea","[""War"", ""Sun"", ""Fire""]"
"1139","Nidhogg is a mythical creature from what mythology?","mythology","Norse","[""Egyptian"", ""Greek"", ""Hindu""]"
"1140","According to Algonquian folklore, how does one transform into a Wendigo?","mythology","Participating in cannibalism.","[""Excessive mutilation of animal corpses."", ""Performing a ritual involving murder."", ""Drinking the blood of many slain animals.""]"
"1141","In most traditions, who was the wife of Zeus?","mythology","Hera","[""Aphrodite"", ""Athena"", ""Hestia""]"
"1142","What was the punishment for Sysiphus's craftiness?","mythology","Cursed to roll a boulder up a hill for eternity.","[""Tied to a boulder for eternity, being pecked by birds."", ""Standing in a lake filled with water he could not drink."", ""To fell a tree that regenerated after every axe swing.""]"
"1143","The Maori hold that which island nation was founded by Kupe, who discovered it under a long white cloud?","mythology","New Zealand","[""Vanuatu"", ""Fiji"", ""Hawaii""]"
"1144","In Greek Mythology, who was the daughter of King Minos?","mythology","Ariadne","[""Athena"", ""Ariel"", ""Alana""]"
"1145","What is the name of the Greek god of peaceful deaths?","mythology","Thanatos","[""Tartarus"", ""Hades"", ""Moros""]"
"1146","Which of these mythological creatures is said to be half-man and half-horse?","mythology","Centaur","[""Minotaur"", ""Pegasus"", ""Gorgon""]"
"1147","The Hippogriff, not to be confused with the Griffon, is a magical creature with the front half of an eagle, and the back half of what?","mythology","A Horse","[""A Dragon"", ""A Tiger"", ""A Lion""]"
"1148","Who is the God Loki's son? ","mythology","Fenrir ","[""Odin"", ""Hel"", ""Sigyn""]"
"1149","The Norse god Odin has two pet crows named ""Huginn"" and ""Muninn"".  What do their names mean?","mythology","Thought & Memory","[""Power & Peace"", ""War & Learning"", ""Sleeping & Waking""]"
"1150","What mythology did the god ""Apollo"" come from?","mythology","Greek and Roman","[""Roman and Spanish"", ""Greek and Chinese"", ""Greek, Roman and Norse""]"
"1151","In African mythology, Anansi is a trickster and storyteller who takes the shape of which animal?","mythology","Spider","[""Wild dog"", ""Monkey"", ""Crocodile""]"
"1152","In Greek Mythology, who killed Achilles?","mythology","Paris","[""Hector"", ""Helen"", ""Pericles""]"
"1153","Which of the following is NOT a god in Norse Mythology.","mythology","Jens","[""Loki"", ""Tyr"", ""Snotra""]"
"1154","Which Greek & Roman god was known as the god of music, truth and prophecy, healing, the sun and light, plague, poetry, and more?","mythology","Apollo","[""Aphrodite"", ""Artemis"", ""Athena""]"
